{
  "workspace_version": "2.0.0",
  "project_id": "WUCHENG_FROZEN",
  "top_level": {"entry": "entry", "stories": "story"},
  "authorities": {"human": "markdown", "machine": ["json", "csv"], "media": "registry"},
  "archive_boundary": {"path": "archive", "mode": "read_only"},
  "id_policy": {"pattern": "^[A-Z][A-Z0-9_]{2,63}$", "charset": "ASCII"},
  "adapter_compatibility": {"filmfoundry": ">=2.0.0,<3.0.0", "project": "frozen-boundary-v3"},
  "required_tools": ["python>=3.11"]
}

